question,document
What is the impact of wearing the same shoes?,f58cf57b
Should I consider different shoes for training?,f58cf57b
What is the purpose of a cool-down after finishing a run?,59698b20
How does a warm-down session benefit the body after a run?,59698b20
Why should runners focus on lowering their heart rate gradually post-run?,59698b20
In what ways can cooling down reduce muscle discomfort after exercising?,59698b20
What are the advantages of a warm-down in preventing post-run soreness?,59698b20
What features make specific running apparel suitable for exercise?,82561d8e
How should running clothes manage moisture during a run?,82561d8e
What properties are essential for effective running attire?,82561d8e
How do ideal running clothes deal with sweat?,82561d8e
What should running wear do to regulate moisture efficiently?,82561d8e
Is heel striking or midfoot running better for health?,093c12e1
What is often regarded as a more efficient running style?,093c12e1
"Which strike is typically considered more beneficial for runners, heel or midfoot?",093c12e1
"In terms of efficiency, should I focus on midfoot or heel striking?",093c12e1
What striking technique is healthier according to running experts?,093c12e1
How does maintaining a healthy posture contribute to running efficiency?,3718796e
What role does proper posture play in injury prevention for runners?,3718796e
Why is it crucial to focus on posture during a run?,3718796e
In what ways can good posture conserve energy while running?,3718796e
How can runners improve their posture to enhance performance?,3718796e
What is the best way to adapt to temperature changes while running outside in winter?,71369326
How can I effectively manage cold temperatures during my running sessions?,71369326
What layering strategy should I use for running in freezing conditions?,71369326
Why are thin layers recommended for winter running?,71369326
How do layers help when running in cold weather?,71369326
How does adequate sleep benefit running recovery?,0dc31468
Why should runners prioritize sleep for performance?,0dc31468
What role does sleep play in a runner's recovery process?,0dc31468
What makes sleep vital for a runner's ability to recover?,0dc31468
How can sleep impact a runner's overall performance?,0dc31468
What is one method to enhance running technique to prevent injury?,b4b15585
How does video analysis contribute to better running posture?,b4b15585
In what way can runners ensure correct body alignment during their run?,b4b15585
Which strategies help in recognizing and correcting improper running form?,b4b15585
How can runners avoid injuries related to poor technique through analysis?,b4b15585
What type of running shoes should I consider if I have knee problems?,c23e4e78
Are there specific features in running shoes that help with knee pain?,c23e4e78
What characteristics in running shoes benefit those with knee issues?,c23e4e78
How can running shoes assist in alleviating knee discomfort?,c23e4e78
What should I look for in running shoes if I have knee difficulties?,c23e4e78
What is the concept of loading on carbohydrates before a long race known as?,469a8d81
How can a runner prepare nutritionally for endurance races?,469a8d81
Could you explain the practice of increasing carbohydrate intake for marathons?,469a8d81
What should athletes do nutritionally to store more energy for a race?,469a8d81
How can runners enhance their glycogen stores before participating in a long-distance event?,469a8d81
What are the benefits of starting barefoot running?,677f0b0c
How can I gradually introduce barefoot running into my routine to avoid injury?,677f0b0c
What steps should I take to ensure safe barefoot running?,677f0b0c
How does barefoot running strengthen foot muscles?,677f0b0c
What precautions should a new barefoot runner take to prevent injuries?,677f0b0c
What is the appropriate pace for maintaining a comfortable conversation during an endurance run?,2fe2c634
How can I determine the right speed for my endurance runs?,2fe2c634
What should the pace feel like if I'm running an endurance session correctly?,2fe2c634
How do I ensure I'm running at the correct pace during long endurance training?,2fe2c634
What conversational ability indicates my pace is suitable for endurance runs?,2fe2c634
What is the best way to maintain running shoes?,ac9c7506
Why is it important to clean running shoes often?,ac9c7506
How can I prevent odors in my running shoes?,ac9c7506
What are the benefits of drying running shoes properly?,ac9c7506
How does regular shoe cleaning impact bacteria growth?,ac9c7506
How does interval training enhance anaerobic performance for runners?,12dd1cfd
In what way does interval training contribute to a runner's speed improvement?,12dd1cfd
Why should runners incorporate interval training to boost their speed?,12dd1cfd
What impact does interval training have on a runner's anaerobic capacity?,12dd1cfd
How can interval training benefit a runner aiming to increase their speed?,12dd1cfd
Can incorporating mental strategies improve a runner's motivation levels?,07624064
What techniques can runners use to ease race-related anxiety?,07624064
In what ways does mental preparation impact a runner's performance?,07624064
How important is mental training in complementing physical training for runners?,07624064
Are there specific mental exercises that can enhance a runner's focus during a race?,07624064
What are the benefits of joining a running club?,471b28c3
How can I find a local running club to join?,471b28c3
What should I expect when attending a running club for the first time?,471b28c3
Are running clubs suitable for beginners as well as experienced runners?,471b28c3
Can joining a running club improve my running performance?,471b28c3
Is stretching before running advisable for muscle preparedness?,1c0ee76f
"In terms of recovery, when should a runner incorporate stretching?",1c0ee76f
Can stretching before a run negatively impact muscle readiness?,1c0ee76f
How does timing of stretching relate to optimal muscle recovery post-run?,1c0ee76f
What is the recommended time to stretch for post-run recovery benefits?,1c0ee76f
What equipment can help runners create training plans?,4a262e9b
How can I keep track of my running progress effectively?,4a262e9b
What tools are available for planning my running workouts?,4a262e9b
How can technology aid in monitoring my running development?,4a262e9b
Which mobile apps can assist in organizing my running schedule?,4a262e9b
What effect does interval training have on metabolism?,ad049dc1
Can interval running contribute to weight loss?,ad049dc1
How does interval training influence fat metabolism?,ad049dc1
What benefits of interval running aid in fat reduction?,ad049dc1
Does interval training boost metabolic rates?,ad049dc1
How do running shoes with pronation support assist runners?,9a4420b5
Why should runners with overpronation choose specific shoes?,9a4420b5
What is the benefit of pronation support in running footwear?,9a4420b5
What role does pronation support play in preventing running injuries?,9a4420b5
How can running shoes address overpronation issues?,9a4420b5
How can setting goals improve my motivation for training?,874e72a7
Why is structuring my run training around goals beneficial?,874e72a7
What role do goals play in maintaining a motivated training schedule?,874e72a7
In what ways do goals contribute to effective run training?,874e72a7
Why should I incorporate goal-setting in my running routine?,874e72a7
How frequently is it necessary to evaluate my running technique?,c313fe54
What is the recommended interval for reviewing running form?,c313fe54
How often should I reassess my running stride for errors?,c313fe54
At what interval should I correct my running technique mistakes?,c313fe54
When should a runner revisit their technique for possible improvements?,c313fe54
Should I modify my running form to match others?,87499400
Is it beneficial to alter my natural running technique?,87499400
Will changing my running style improve my performance?,87499400
Can adjusting my running style help prevent injuries?,87499400
Is it necessary to overhaul my current running technique?,87499400
How can running improve my immune system?,0953dce2
In what ways does running reduce illness susceptibility?,0953dce2
Can running help me get sick less often?,0953dce2
What effect does running have on my body's defenses?,0953dce2
Does running enhance my immune function?,0953dce2
