question,document
How does alternating between intense and recovery phases benefit a runner?,1ce0afbb
Can combining high and low intensity in workouts enhance both aerobic and anaerobic capabilities?,1ce0afbb
What are the benefits of challenging your body with varying intensity levels during a run?,1ce0afbb
Why might a runner consider incorporating phases of intense effort and rest in their training?,1ce0afbb
How can alternating effort levels in training improve a runner's endurance and speed?,1ce0afbb
"How do long, slow runs benefit endurance training?",c4c003a1
"Why are long, slow runs important for the cardiovascular system?",c4c003a1
"What role do long, slow runs play in fat-burning?",c4c003a1
"How do long, slow runs prepare muscles and tendons?",c4c003a1
"What advantages do long, slow runs offer for basic endurance?",c4c003a1
How does recovery aid the process of muscle repair in runners?,0c19360d
What are the potential risks of neglecting sufficient recovery time in a running routine?,0c19360d
In what ways does adequate recovery contribute to a runner's adaptation to training?,0c19360d
Why might a runner experience decreased performance from inadequate recovery?,0c19360d
How can lack of recovery lead to overuse injuries in runners?,0c19360d
How does dehydration impact my performance during a run?,ad4be0ae
Why should I regularly drink water during training?,ad4be0ae
What are the risks of not staying hydrated while running?,ad4be0ae
How does sweating affect my water needs when running?,ad4be0ae
Why is it crucial to hydrate before and after a run?,ad4be0ae
What are the common symptoms of overtraining in runners?,e0c5e964
How does overtraining affect sleep and performance?,e0c5e964
Which signs suggest a runner might be training too intensely or frequently?,e0c5e964
Why is it essential for runners to pay attention to their body's warning signals?,e0c5e964
How important is recovery time in preventing overtraining for runners?,e0c5e964
What features should I look for in a running shoe?,163657ef
How can I ensure my running shoes suit my running style?,163657ef
What is the importance of cushioning in a running shoe?,163657ef
How do I know if my running shoe fits well?,163657ef
What role does a properly fitted shoe play in preventing injuries?,163657ef
How does a balanced diet affect running performance and recovery?,f98e93ac
"Why are carbohydrates, proteins, and fats essential for runners?",f98e93ac
What impact does nutrition have on a runner's ability to perform?,f98e93ac
How can diet support the recovery of runners?,f98e93ac
In what ways does proper nutrition influence a runner's performance?,f98e93ac
How does warming up before running benefit my body?,2589070c
What are the main reasons for including a warm-up in my training routine?,2589070c
In what ways does warming up help reduce the risk of injury when running?,2589070c
Why should I increase blood flow before starting my run?,2589070c
What role does joint mobilization play during a warm-up for running?,2589070c
Is stretching better done before or after running?,f999460e
How does stretching after a run influence recovery?,f999460e
What type of stretching is recommended after completing a run?,f999460e
Why might static stretching not be ideal before running?,f999460e
Can post-run stretching impact flexibility?,f999460e
How can I improve my anaerobic threshold through training?,47001ba8
What type of run helps in increasing my running speed?,47001ba8
How do I perform runs that are at a faster but controlled pace?,47001ba8
Which runs are effective for enhancing both speed and threshold?,47001ba8
What techniques can be used to make my runs both fast and manageable?,47001ba8
What heart rate zone supports building endurance?,da1147b0
Which heart rate zone enhances cardiovascular health during training?,da1147b0
In which heart rate zone is fat burning optimized when running?,da1147b0
What is the recommended heart rate zone for endurance training?,da1147b0
Which heart rate zone should be maintained for effective endurance workouts?,da1147b0
How can I gradually incorporate barefoot running into my routine?,5c4c426e
What precautions should I take when starting barefoot running?,5c4c426e
Will barefoot running help improve my running form?,5c4c426e
Are there specific exercises to strengthen my feet for barefoot running?,5c4c426e
What are the potential risks involved in barefoot running?,5c4c426e
What distance does a marathon cover?,b8da8e90
What specific length is a marathon race?,b8da8e90
How many kilometers is a marathon run?,b8da8e90
What is the standard distance for a marathon event?,b8da8e90
How far do marathon runners typically race?,b8da8e90
What are the key elements of good running technique?,5185d4ec
How can I improve my running posture to avoid injuries?,5185d4ec
What does efficient running technique involve?,5185d4ec
How important is foot movement in maintaining proper running form?,5185d4ec
Why is short ground contact time crucial in running?,5185d4ec
What components are important in a runner's training plan?,3b09a389
How can I adjust my training plan to fit my schedule?,3b09a389
What factors should I consider when creating a running plan?,3b09a389
How do I incorporate various types of training into my schedule?,3b09a389
What makes a training plan effective for different goals?,3b09a389
How does strength training support running performance?,efc8d83a
Why should runners incorporate stability exercises into their routine?,efc8d83a
In what ways does strengthening muscles help runners?,efc8d83a
What role does strength training play in injury prevention for runners?,efc8d83a
Why is improving stability crucial for runners through strength training?,efc8d83a
What type of shoes should runners with flat feet consider?,abc6b5bf
Can you recommend the right shoes for a runner who overpronates?,abc6b5bf
What's the best footwear for a runner with a normal arch?,abc6b5bf
How should runners select shoes based on their running style?,abc6b5bf
Why are stability shoes important for certain runners?,abc6b5bf
How can I improve my running economy for better efficiency?,ea7e3a07
What are some key factors that influence running economy?,ea7e3a07
Why is running economy important for achieving faster times?,ea7e3a07
Can running economy contribute to reducing fatigue during a race?,ea7e3a07
How does running form impact running economy and overall performance?,ea7e3a07
What training strategies should I adjust before competition?,a84e0e85
How can I manage my nutrition leading up to a race?,a84e0e85
What is the optimal way to recover while preparing for competition?,a84e0e85
What steps should I take in increasing training intensity before a race?,a84e0e85
How do I ensure my preparation is well-rounded before an event?,a84e0e85
How does running on asphalt compare to forest trails in terms of joint stress?,47feceec
What are the advantages of planning routes on asphalt?,47feceec
Is running on asphalt generally faster than other surfaces?,47feceec
What impact does asphalt have on joint stress compared to softer surfaces?,47feceec
Why might someone choose asphalt over forest trails for running routes?,47feceec
What is the recommended way to breathe while running to ensure proper oxygen supply and prevent fatigue?,b1cc9421
How can breathing through both the nose and mouth benefit a runner during their training sessions?,b1cc9421
Why is it important to focus on breathing techniques while running?,b1cc9421
What role does proper breathing play in a runner's overall performance and endurance?,b1cc9421
Can improper breathing methods lead to increased fatigue during long runs?,b1cc9421
How can a heart rate monitor aid in tracking progress for runners?,d9eddb43
What role does a heart rate monitor play in managing a runner's training?,d9eddb43
In what ways can a heart rate monitor help prevent a runner from overexerting?,d9eddb43
Why should a runner consider using a heart rate monitor during training?,d9eddb43
What are the advantages of using a heart rate monitor for a runner's training regimen?,d9eddb43
What is the best time to stretch during a running routine?,82a46224
How can runners enhance their flexibility after a run?,82a46224
What is the difference between stretching and warm-ups for runners?,82a46224
Why should runners focus on dynamic warm-ups before running?,82a46224
How does stretching contribute to a runner's post-run routine?,82a46224
What surfaces does trail running typically involve?,5bf8a870
Why does trail running require special shoes?,5bf8a870
What should I focus on for safety during trail running?,5bf8a870
How does trail running differ from road running in terms of technique?,5bf8a870
What are key considerations when choosing trails for running?,5bf8a870
How does fartlek training improve endurance?,b2da86ac
What are the components of a fartlek session?,b2da86ac
In what way does fartlek training enhance speed?,b2da86ac
What distinguishes fartlek training from interval training?,b2da86ac
Why should a runner include fartlek training in their routine?,b2da86ac
How do carbohydrates and proteins each contribute to a runner's performance?,adcde382
What is the primary energy source for runners?,adcde382
Why are proteins important for muscle recovery in running?,adcde382
Which macronutrient is crucial for energy during running?,adcde382
What role do proteins play in a runner's diet?,adcde382
How can I prevent injuries when increasing my running mileage?,607985ef
What should I consider when selecting running shoes to avoid injuries?,607985ef
Why is it important to pay attention to my running technique?,607985ef
What are the risks of increasing my running intensity too fast?,607985ef
How can identifying early signs of injuries benefit my running?,607985ef
How can cross-training support a runner's fitness levels?,58f296d6
In what ways does cross-training with cycling benefit runners?,58f296d6
What role does swimming play in a runner's cross-training routine?,58f296d6
How does cross-training contribute to injury prevention for runners?,58f296d6
Why should runners consider incorporating cross-training into their schedule?,58f296d6
What is the purpose of running drills in training?,95fe2e34
How can running ABCs benefit a runner's technique?,95fe2e34
Why should I include coordination exercises in my running routine?,95fe2e34
What are the benefits of improving mobility through running ABCs?,95fe2e34
How do drills enhance running coordination?,95fe2e34
How can I improve my anaerobic threshold through running?,0442346c
What type of run involves maintaining a consistently faster pace?,0442346c
What should I include in my training to increase speed and endurance?,0442346c
What is an effective way to train for faster running sessions?,0442346c
How can tempo runs benefit my overall training plan?,0442346c
What is the benefit of plyometric training for a runner?,5f4ef8b0
How does explosive strength from plyometrics affect my running?,5f4ef8b0
Can you explain how plyometric exercises improve running performance?,5f4ef8b0
Why should a runner consider adding plyometric training to their routine?,5f4ef8b0
What impact does plyometric training have on a runner's strength?,5f4ef8b0
What type of meals are recommended before running a race?,3a2b9c55
Which nutrients support optimal performance in a race?,3a2b9c55
How can athletes avoid stomach problems during a race?,3a2b9c55
Why is carbohydrate intake important before racing?,3a2b9c55
What should runners consider for pre-race nutrition?,3a2b9c55
At what mileage should I consider changing my running shoes?,2ec14a1d
How many kilometers can I run before needing new shoes?,2ec14a1d
When do running shoes begin to lose their cushioning?,2ec14a1d
What is the recommended distance limit for using a single pair of running shoes?,2ec14a1d
How often should I replace my running footwear based on usage?,2ec14a1d
What are key characteristics of an efficient running movement?,34630185
How does avoiding overpronation impact running?,34630185
Why is natural running style important for runners?,34630185
What are the benefits of promoting efficient running movement?,34630185
How can runners develop a more natural running style?,34630185
How can integrating races into a training plan benefit a runner?,4cd0d412
What role do races play in enhancing a runner's motivation?,4cd0d412
In what way should runners use races to set training goals?,4cd0d412
Why is it important for runners to participate in races?,4cd0d412
How do races influence a runner's training objectives?,4cd0d412
What are the mental health benefits of running?,cd51a135
In what ways does running reduce stress?,cd51a135
How can running enhance overall well-being?,cd51a135
Does running have a positive impact on mental health?,cd51a135
Why is running considered beneficial for mental health?,cd51a135
What benefits does regular running analysis provide?,612de32f
Why is technique important for preventing injuries?,612de32f
How can runners improve their technique using analysis?,612de32f
What role does running analysis play in injury prevention?,612de32f
How does analyzing running form contribute to better performance?,612de32f
How can I stay motivated while training alone?,ce311f88
What are the advantages of running with others?,ce311f88
Why might some runners prefer group activities?,ce311f88
How does social interaction impact running performance?,ce311f88
What role does motivation play when running in a group?,ce311f88
How do energy gels support a runner during a long-distance race?,16792956
What role do sports drinks play in maintaining hydration for endurance athletes?,16792956
In what scenarios are energy gels beneficial for runners?,16792956
Why might runners need to replenish energy stores during extended workouts?,16792956
How can hydration be effectively maintained while running long distances?,16792956
What are the key features of apparel for runners?,990e5b26
How should running clothes adapt to weather?,990e5b26
What characteristics make running clothing suitable?,990e5b26
Why is it important for running attire to be breathable?,990e5b26
What should I look for in lightweight running gear?,990e5b26
How do compression socks aid in recovery for runners?,67b8dffd
What role do compression socks play in enhancing blood circulation for athletes?,67b8dffd
In what ways can runners benefit from wearing compression socks during runs?,67b8dffd
Why might a runner choose to include compression socks in their recovery routine?,67b8dffd
What are the effects of compression socks on a runner's circulatory system?,67b8dffd
How does running on uneven terrain impact muscle strength?,efd64e33
In what ways does coordination benefit from running on uneven surfaces?,efd64e33
Why should I include uneven terrain runs in my training routine?,efd64e33
What are the advantages of terrain variability while running?,efd64e33
How can running on different terrains improve my overall performance?,efd64e33
What is the significance of taking regular breaks in a running schedule?,121fc1d0
How can rest days contribute to preventing injuries for runners?,121fc1d0
Why should a runner prioritize including rest periods in their training routine?,121fc1d0
In what ways do rest days facilitate a runner's physical recovery?,121fc1d0
Why is it critical to incorporate rest days for optimal running performance?,121fc1d0
What are the benefits of running at high altitudes?,f8429f36
How can training at altitude enhance a runner's endurance?,f8429f36
In what ways does altitude affect oxygen intake for athletes?,f8429f36
Why might runners choose to train at high elevations?,f8429f36
How can altitude improve a runner's performance?,f8429f36
What are the benefits of using a running journal?,955515f0
How can documenting progress aid in running?,955515f0
What role does a running journal have in training plans?,955515f0
Why is it important to track progress for running?,955515f0
How does a running journal impact training adjustments?,955515f0
What cadence helps prevent running injuries most effectively?,32e0fc5f
How many steps per minute are recommended for efficient running?,32e0fc5f
What is the best cadence to minimize overuse injuries in runners?,32e0fc5f
Which cadence is suggested for optimal running technique?,32e0fc5f
"To avoid injuries, how many steps should a runner aim to take per minute?",32e0fc5f
What type of shoes helps in keeping feet dry and reducing blisters?,6004157e
How do well-ventilated shoes benefit a runner?,6004157e
What features should running shoes have to prevent blisters?,6004157e
How can shoe ventilation impact foot health during runs?,6004157e
What role do shoes play in preventing blisters while running?,6004157e
How does core strength training benefit a runner's performance?,c7adfc69
What role does core training play in injury prevention for runners?,c7adfc69
What improvements can runners expect from regular core workouts?,c7adfc69
Why should runners incorporate leg strength exercises in their routine?,c7adfc69
How can core strength exercises aid in reducing running-related injuries?,c7adfc69
How can yoga contribute to a runner's flexibility?,6cdba9aa
In what ways does yoga help runners achieve mental calmness?,6cdba9aa
What role does flexibility play in a runner's training routine?,6cdba9aa
Why is mental calmness important for runners?,6cdba9aa
How does the practice of yoga benefit a runner overall?,6cdba9aa
How can I determine my optimal pace for races?,a6181db6
What factors should I consider to find my ideal race pace?,a6181db6
Why is it crucial to maintain the correct race pace?,a6181db6
How does pacing affect race performance and endurance?,a6181db6
What are the consequences of not maintaining the right pace during a race?,a6181db6
When should I try on new running shoes?,cd3cd99b
Why is evening recommended for fitting running shoes?,cd3cd99b
How does foot swelling affect shoe fitting?,cd3cd99b
What time of day is optimal for shoe shopping?,cd3cd99b
"Does foot size change throughout the day, affecting shoe fit?",cd3cd99b
How can inadequate cushioning in running shoes affect my joints?,d525bab2
What happens to my joints during long runs if my shoes lack cushioning?,d525bab2
Why is it important to have enough cushioning in my running shoes?,d525bab2
Can insufficient cushioning in my shoes cause joint pain while running?,d525bab2
Are joint problems common with poorly cushioned running shoes?,d525bab2
How many liters of water per day are necessary to stay hydrated as a runner?,a2ea68df
What is the recommended daily water intake for maintaining proper hydration while running?,a2ea68df
How much water is advised to consume each day to ensure hydration for runners?,a2ea68df
What is the minimum daily water consumption necessary for runners to stay properly hydrated?,a2ea68df
Can you tell me the suggested amount of water runners should drink every day to remain hydrated?,a2ea68df
How can I speed up muscle recovery after running?,ecf85be9
What role do protein shakes play in muscle recovery?,ecf85be9
Are protein shakes beneficial for recovery post-run?,ecf85be9
When should runners consider using protein shakes?,ecf85be9
Why might a runner choose to include protein shakes in their diet?,ecf85be9
What can enhance my visibility during evening runs?,91ecff08
What should I wear to ensure safety in low-light conditions?,91ecff08
How do I increase my visibility when running at night?,91ecff08
What type of clothing is recommended for safe nighttime running?,91ecff08
How can I be more visible to others while running in the dark?,91ecff08
How can I avoid heat-related issues when running in midday sun?,0d15f91c
What considerations are important for staying cool while running in the heat?,0d15f91c
What should I wear when running during hot weather to stay comfortable?,0d15f91c
How does adequate hydration contribute to preventing heat stress when running?,0d15f91c
What are the best practices for managing heat during a midday run?,0d15f91c
What happens to muscles in cold weather that makes warming up crucial?,0a0f9398
How does cold weather affect the importance of a warm-up?,0a0f9398
Why should I focus on warming up more during colder months?,0a0f9398
Can skipping warm-ups in chilly conditions lead to problems?,0a0f9398
What are the risks of not warming up properly when it's cold outside?,0a0f9398
How can breaking in running shoes help prevent blisters?,ea6f312f
What is the importance of adapting new running shoes to your feet?,ea6f312f
Why is it essential to gradually acclimate your feet to new running shoes?,ea6f312f
How does breaking in shoes improve comfort during runs?,ea6f312f
What are the benefits of properly breaking in running shoes over time?,ea6f312f
How does toe running impact foot strength?,2761f95d
In what ways can running technique be enhanced?,2761f95d
What benefits does strengthening foot muscles offer?,2761f95d
How might foot muscle strength influence running form?,2761f95d
Why should runners consider technique improvements?,2761f95d
How does training for hip stability benefit runners?,e2c96f40
What is the role of hip stability in preventing knee injuries for runners?,e2c96f40
Why should runners consider incorporating hip stability exercises in their routine?,e2c96f40
What are the consequences of neglecting hip stability training for runners?,e2c96f40
How can hip stability affect a runner's overall injury risk?,e2c96f40
How does a GPS watch help improve a runner's training?,134ae126
Why should a runner consider using a GPS watch?,134ae126
In what ways can tracking routes benefit a runner?,134ae126
What advantages does monitoring training progress with a GPS watch offer?,134ae126
How can GPS technology enhance a runner's performance analysis?,134ae126
What is the ideal running time for novices?,66bbe4f8
How many minutes should beginners run to prevent strain?,66bbe4f8
What duration is recommended for new runners?,66bbe4f8
How long should a novice run to avoid overstraining?,66bbe4f8
What is a safe duration for a beginner's run?,66bbe4f8
Why is social support beneficial in group running?,44aaffdd
How does running with others affect motivation?,44aaffdd
In what ways does training with a group become more varied?,44aaffdd
What motivates runners to join group sessions?,44aaffdd
How do group runs make training sessions different?,44aaffdd
questions,9676492f
What actions should I take if I experience discomfort during my run?,0d9c398a
"If I start feeling pain while running, what are the recommended steps?",0d9c398a
"When facing pain during a run, what is the best immediate course of action?",0d9c398a
How should I address pain encountered during my running session?,0d9c398a
"While running, if pain arises, what are the advised precautions?",0d9c398a
How do braces benefit runners?,0d346d78
What role do athletic supports play in injury prevention?,0d346d78
Why might a runner need joint stabilization?,0d346d78
In what situations should a runner consider using braces?,0d346d78
How can braces contribute to a safe running experience?,0d346d78
How does a running analysis improve my technique?,661b328a
What can a professional running analysis reveal about my running style?,661b328a
Why should I consider getting a running analysis for my performance?,661b328a
What issues can be identified with a running analysis?,661b328a
How can a running analysis benefit my overall running efficiency?,661b328a
How can trail running impact my muscle development?,7505e5e7
What role does trail running play in enhancing coordination?,7505e5e7
Is trail running beneficial for muscle strengthening?,7505e5e7
In what ways does trail running improve physical coordination?,7505e5e7
Why should I incorporate trail running into my workout routine for muscle benefits?,7505e5e7
How can running help alleviate stress?,51e2d1a7
What effect does running have on mood?,51e2d1a7
Why is running beneficial for managing stress?,51e2d1a7
How does running contribute to improving mental health?,51e2d1a7
In what ways does running enhance emotional well-being?,51e2d1a7
What is the ideal amount of space to leave in front of the toes when selecting running shoes?,410e6031
How much wiggle room should there be for toes in running footwear to avoid discomfort?,410e6031
What is the recommended distance between the toes and the end of the shoe in running shoes?,410e6031
How can I ensure my running shoes fit properly in the toe area?,410e6031
What guideline should I follow for toe space in running shoe sizing?,410e6031
How does jogging compare to brisk walking in terms of workout intensity?,6c540d10
Can you explain the joint impact differences between jogging and brisk walking?,6c540d10
In what ways are jogging and brisk walking both effective for endurance training?,6c540d10
What distinguishes the effectiveness of jogging from brisk walking?,6c540d10
What are the main differences between jogging and brisk walking?,6c540d10
How can I recover fully before a race?,3b420ee1
What is the purpose of reducing training volume pre-race?,3b420ee1
Can you explain the concept of tapering?,3b420ee1
What does it mean to taper before running an event?,3b420ee1
How do you prepare for a race to ensure optimal recovery?,3b420ee1
How can running benefit my cardiovascular system?,b182cf59
What impact does running have on heart health?,b182cf59
In what way does running enhance heart function?,b182cf59
How does running influence blood pressure?,b182cf59
What are the heart health benefits of regular running?,b182cf59
How can muscle cramps in the diaphragm during running be relieved?,d7a9507c
What is a method to soothe side stitches when running?,d7a9507c
What is the recommended way to alleviate side stitches?,d7a9507c
How can controlled breathing help with side cramps while running?,d7a9507c
What technique assists in avoiding side stitches while training?,d7a9507c
Is it important to rotate different shoes?,f58cf57b
How can shoe wear affect performance?,f58cf57b
Why might alternating shoes be beneficial?,f58cf57b
